{"Identifier": "IDS-624", "Title": "Capital Financial Holdings v. Cameroon", "CaseNumber": "ICSID Case No. ARB/15/18", "Industries": ["Financial Services", "Other non-bank financial institutions"], "Status": "Decided in favor of State", "PartyNationalities": ["Cameroon", "Luxembourg"], "Institution": "ICSID - International Centre for Settlement of Investment Disputes", "RulesOfArbitration": ["ICSID (International Centre for Settlement of Investment Disputes) Rules of Procedure for Arbitration Proceedings (2006)"], "ApplicableTreaties": ["Convention Between the Belgo-Luxembourg Economic Union and the United Republic of Cameroon Concerning the Reciprocal Promotion and Protection of Investments (1980)"], "Decisions": []}