{"Identifier": "IDS-254", "Title": "TCW v. Dominican Republic", "CaseNumber": "PCA Case No. 2008-06", "Industries": ["Energy - Electric Power", "Electric power transmission and distribution"], "Status": "Settled", "PartyNationalities": ["Dominican Republic", "United States"], "Institution": "PCA - Permanent Court of Arbitration", "RulesOfArbitration": ["UNCITRAL (United Nations Commission on International Trade Law) Arbitration Rules (1976)"], "ApplicableTreaties": ["Free Trade Agreement Between Central America, the Dominican Republic and the United States of America (CAFTA) (2004)"], "Decisions": [{"Title": "Consent Award", "Type": "Decision on parties\u2019 agreement", "Date": "2009-07-16T00:00:00Z", "Opinions": [], "Content": "Consent Award\n-------------\n\n[1].\n\nAfter reviewing the Settlement, Transfer and Mutual Release Agreement dated May 26, 2009 (the \"Agreement\") between Claimants and Respondent (each, a \"Party\" and collectively, the \"Parties\"), the Tribunal records by consent the irrevocable statements made to the Tribunal by the Parties in their letter dated June 30,2009 (the \"Joint Letter\") that:\n\n1. This arbitral proceeding and the disputes and differences over which this Tribunal possesses jurisdiction have been fully and finally settled in accordance with and pursuant to the terms of the Agreement.\n\n2. Claimants and Respondent submit themselves to the jurisdiction of the Tribunal for the purposes of making this Consent Award.\n\n3. Claimants and Respondent jointly agree that no Party has admitted any liability by entering into the Agreement, and that neither the Agreement nor this Consent Award shall be construed or deemed to be evidence of a presumption, concession or admission of any liability or wrongdoing on the part of either Party.\n\n[2].\n\nPursuant to Article 34(1) of the UNCITRAL Arbitration Rules, the Tribunal makes this Consent Award as follows:\n\n1. In accordance with and pursuant to the terms of the full and final settlement agreed between Claimants and Respondent, the arbitral proceedings are hereby terminated.\n\n2. Claimants on the one hand, and Respondent on the other, shall bear equally the Tribunal's fees and expenses.\n\n3. Claimants on the one hand, and Respondent on the other, shall bear equally the fees and expenses of the Permanent Court of Arbitration incurred in connection with this arbitration.\n\n4. Each Party shall bear its own attorneys' fees, expenses and other costs with respect to these arbitral proceedings.\n\n[3].\n\nThe Tribunal records that it has made this Consent Award in accordance with the Parties' request in their Joint Letter.\n\n[4].\n\nMADE at the place of arbitration, New York, this 16th day of July 2009."}]}